{
    "@id": "mip-cmor-tables:organisations/consortia/messy-consortium",
    "@type": "cmip:consortium",
    "consortium:cmip_acronym": "MESSy-Consortium",
    "consortium:description": "The Modular Earth Submodel System (MESSy) Consortium",
    "consortium:url": "",
    "consortium:changes": "",
    "consortium:members": {
        "@set": [
            {
                "@id": "Institute for Physics of the Atmosphere, Deutsches Zentrum fur Luft- und Raumfahrt (DLR), Wessling, Bavaria 82234, Germany"
            }
        ]
    }
}